{
  "runId": "recorded-modal-focus-issue",
  "interaction": {
    "id": "interaction:click:1788242303022",
    "runId": "recorded-modal-focus-issue",
    "timestamp": "2026-09-01T05:58:23.022Z",
    "actor": "test",
    "kind": "click",
    "target": {
      "role": "button",
      "name": "Delete Project Alpha"
    },
    "meta": {
      "focusExpectation": "inside-dialog"
    }
  },
  "checkpoint": {
    "id": "checkpoint:manual:1788242303022",
    "runId": "recorded-modal-focus-issue",
    "name": "public-demo-modal-focus-broken",
    "url": "./?recording=1&label=fixed&focus=broken",
    "timestamp": "2026-09-01T05:58:23.022Z",
    "trigger": "manual"
  },
  "records": [
    {
      "id": "dom:before:1788242303024",
      "runId": "recorded-modal-focus-issue",
      "checkpointId": "checkpoint:manual:1788242303022",
      "interactionId": "interaction:click:1788242303022",
      "observerId": "dom",
      "observerVersion": "0.1.0",
      "phase": "before",
      "status": "ok",
      "timestamp": "2026-09-01T05:58:23.024Z",
      "summary": "Captured DOM before state.",
      "beforeStateRef": {
        "id": "dom:before:artifact",
        "kind": "dom-snapshot",
        "path": "./site/demo-artifacts/recorded-modal-focus-issue/artifacts/dom-before.html",
        "mediaType": "text/html"
      },
      "artifacts": [
        {
          "id": "dom:before:artifact",
          "kind": "dom-snapshot",
          "path": "./site/demo-artifacts/recorded-modal-focus-issue/artifacts/dom-before.html",
          "mediaType": "text/html"
        }
      ],
      "meta": {
        "byteLength": 18554
      }
    },
    {
      "id": "focus:before:1788242303025",
      "runId": "recorded-modal-focus-issue",
      "checkpointId": "checkpoint:manual:1788242303022",
      "interactionId": "interaction:click:1788242303022",
      "observerId": "focus",
      "observerVersion": "0.1.0",
      "phase": "before",
      "status": "ok",
      "timestamp": "2026-09-01T05:58:23.025Z",
      "summary": "Captured focus before state (button #delete-project \"Delete Project Alpha\").",
      "artifacts": [
        {
          "id": "focus:before:artifact",
          "kind": "custom",
          "path": "./site/demo-artifacts/recorded-modal-focus-issue/artifacts/focus-before.json",
          "mediaType": "application/json"
        }
      ],
      "meta": {
        "focusTarget": {
          "tagName": "button",
          "id": "delete-project",
          "name": "Delete Project Alpha",
          "type": "button",
          "tabIndex": 0,
          "disabled": false,
          "focusOrderIndex": 9,
          "focusableCount": 16
        }
      }
    },
    {
      "id": "visual:before:1788242303066",
      "runId": "recorded-modal-focus-issue",
      "checkpointId": "checkpoint:manual:1788242303022",
      "interactionId": "interaction:click:1788242303022",
      "observerId": "visual",
      "observerVersion": "0.1.0",
      "phase": "before",
      "status": "ok",
      "timestamp": "2026-09-01T05:58:23.066Z",
      "summary": "Captured screenshot before state.",
      "beforeStateRef": {
        "id": "visual:before:artifact",
        "kind": "screenshot",
        "path": "./site/demo-artifacts/recorded-modal-focus-issue/artifacts/visual-before.png",
        "mediaType": "image/png"
      },
      "artifacts": [
        {
          "id": "visual:before:artifact",
          "kind": "screenshot",
          "path": "./site/demo-artifacts/recorded-modal-focus-issue/artifacts/visual-before.png",
          "mediaType": "image/png"
        }
      ],
      "meta": {
        "byteLength": 108522
      }
    },
    {
      "id": "dom:after:1788242303594",
      "runId": "recorded-modal-focus-issue",
      "checkpointId": "checkpoint:manual:1788242303022",
      "interactionId": "interaction:click:1788242303022",
      "observerId": "dom",
      "observerVersion": "0.1.0",
      "phase": "after",
      "status": "ok",
      "timestamp": "2026-09-01T05:58:23.594Z",
      "summary": "Captured DOM after state with observable markup changes.",
      "afterStateRef": {
        "id": "dom:after:artifact",
        "kind": "dom-snapshot",
        "path": "./site/demo-artifacts/recorded-modal-focus-issue/artifacts/dom-after.html",
        "mediaType": "text/html"
      },
      "artifacts": [
        {
          "id": "dom:after:artifact",
          "kind": "dom-snapshot",
          "path": "./site/demo-artifacts/recorded-modal-focus-issue/artifacts/dom-after.html",
          "mediaType": "text/html"
        }
      ],
      "changes": [
        {
          "path": "dom.html",
          "summary": "DOM markup changed after the interaction.",
          "before": {
            "byteLength": 18554
          },
          "after": {
            "byteLength": 18558
          },
          "impact": "major"
        }
      ],
      "meta": {
        "byteLength": 18558,
        "changed": true,
        "previousByteLength": 18554
      }
    },
    {
      "id": "focus:after:1788242303594",
      "runId": "recorded-modal-focus-issue",
      "checkpointId": "checkpoint:manual:1788242303022",
      "interactionId": "interaction:click:1788242303022",
      "observerId": "focus",
      "observerVersion": "0.1.0",
      "phase": "after",
      "status": "ok",
      "timestamp": "2026-09-01T05:58:23.594Z",
      "summary": "Captured focus after state (button #delete-project \"Delete Project Alpha\").",
      "artifacts": [
        {
          "id": "focus:after:artifact",
          "kind": "custom",
          "path": "./site/demo-artifacts/recorded-modal-focus-issue/artifacts/focus-after.json",
          "mediaType": "application/json"
        }
      ],
      "meta": {
        "focusTarget": {
          "tagName": "button",
          "id": "delete-project",
          "name": "Delete Project Alpha",
          "type": "button",
          "tabIndex": 0,
          "disabled": false,
          "focusOrderIndex": 9,
          "focusableCount": 18
        }
      }
    },
    {
      "id": "visual:after:1788242303636",
      "runId": "recorded-modal-focus-issue",
      "checkpointId": "checkpoint:manual:1788242303022",
      "interactionId": "interaction:click:1788242303022",
      "observerId": "visual",
      "observerVersion": "0.1.0",
      "phase": "after",
      "status": "ok",
      "timestamp": "2026-09-01T05:58:23.636Z",
      "summary": "Captured screenshot after state.",
      "afterStateRef": {
        "id": "visual:after:artifact",
        "kind": "screenshot",
        "path": "./site/demo-artifacts/recorded-modal-focus-issue/artifacts/visual-after.png",
        "mediaType": "image/png"
      },
      "artifacts": [
        {
          "id": "visual:after:artifact",
          "kind": "screenshot",
          "path": "./site/demo-artifacts/recorded-modal-focus-issue/artifacts/visual-after.png",
          "mediaType": "image/png"
        }
      ],
      "meta": {
        "byteLength": 99292
      }
    }
  ],
  "artifacts": [
    {
      "id": "dom:before:artifact",
      "kind": "dom-snapshot",
      "path": "./site/demo-artifacts/recorded-modal-focus-issue/artifacts/dom-before.html",
      "mediaType": "text/html"
    },
    {
      "id": "focus:before:artifact",
      "kind": "custom",
      "path": "./site/demo-artifacts/recorded-modal-focus-issue/artifacts/focus-before.json",
      "mediaType": "application/json"
    },
    {
      "id": "visual:before:artifact",
      "kind": "screenshot",
      "path": "./site/demo-artifacts/recorded-modal-focus-issue/artifacts/visual-before.png",
      "mediaType": "image/png"
    },
    {
      "id": "dom:after:artifact",
      "kind": "dom-snapshot",
      "path": "./site/demo-artifacts/recorded-modal-focus-issue/artifacts/dom-after.html",
      "mediaType": "text/html"
    },
    {
      "id": "focus:after:artifact",
      "kind": "custom",
      "path": "./site/demo-artifacts/recorded-modal-focus-issue/artifacts/focus-after.json",
      "mediaType": "application/json"
    },
    {
      "id": "visual:after:artifact",
      "kind": "screenshot",
      "path": "./site/demo-artifacts/recorded-modal-focus-issue/artifacts/visual-after.png",
      "mediaType": "image/png"
    }
  ],
  "correlation": {
    "strategy": "observer-record-grouping",
    "participatingObserverIds": [
      "dom",
      "focus",
      "visual"
    ]
  }
}